{
  "meta": {
    "sermon_title": "When Will Jesus Return? 4 Predictions About the End Times",
    "preacher": "Pastor Josh Howerton",
    "church": "Lakepointe Church",
    "church_location": "Rockwall, TX",
    "series": "Investigating Jesus",
    "preaching_text": "Luke 21:5–28 and Matthew 24 (the Olivet Discourse)",
    "youtube_id": "7CLwe3JW9tU",
    "upload_date": "2026-04-12",
    "runtime_seconds": 3420,
    "transcript_path": "transcripts/20260412_howerton_end_times.txt",
    "gospel_translation": "ESV"
  },
  "summary": "Howerton frames history as three ages (Judaism → Time of the Gentiles → Return of Christ), argues the first age ended with the 70 AD destruction of the Temple, and spends the back half of the sermon walking through four \"signs\" from Matthew 24 — culminating in a 5-minute argument identifying Islam, and specifically the Mahdi of Islamic eschatology, as the biblical Antichrist. The sermon closes with an altar-style call to enroll in Lakepointe's 10-week \"Rooted\" discipleship program.",
  "scorecard": {
    "axis_1": {
      "label": "Fidelity to Jesus's Teachings (Red Letters)",
      "verdict": "Mixed",
      "severity": "moderate",
      "headline": "Six flagged items. Anti-Muslim eschatology inverts Jesus's pattern with religious outsiders (Luke 9:55; Luke 10:33). Matthew 25 — Jesus's own answer to the sermon's own question — is not referenced once."
    },
    "axis_2": {
      "label": "Identifiable Biases / Harmful Rhetoric",
      "verdict": "Severe anti-Muslim eschatology",
      "severity": "severe",
      "headline": "A 5-minute structured argument identifying Islam as the religion of the Antichrist, preached to ~53,000 weekly attendees. Plus three Christian nationalism markers (national identity, political opponents as spiritual enemies, persecution jeremiad)."
    },
    "axis_3": {
      "label": "Factual Claims & Evidence Check",
      "verdict": "Poor evidence hygiene",
      "severity": "moderate",
      "headline": "Of 4 fact-checked claims, 0 are fully supported. One is contested under the pastor's implied methodology, one is partially supported but overstated, one is misleading (conflates affiliation with tolerance), and one is unsupported (political voting warning with no specified referent). No claim was delivered with a cited source."
    },
    "axis_4": {
      "label": "Whole-Bible Engagement",
      "verdict": "Selective; minority readings favored",
      "severity": "severe",
      "headline": "On the sermon's most significant themes — enemies, political engagement, national identity, persecution, end-times sign-reading — the pastor consistently draws from minority biblical voices while omitting the dominant canonical counter-witness. Jesus's Gospel position and the wider Bible converge *against* the pastor's framing on all five themes analyzed."
    }
  },
  "tenets_affirmed": [
    "Olivet Discourse exposition (Luke 21, Matt 24) is textually grounded and historically framed (70 AD siege under Titus).",
    "Great Commission explanation is linguistically accurate — ta ethne = “all nations / all peoples” (Matt 28:19).",
    "Multiple direct Jesus quotations are rendered faithfully: “my words will never pass away” (Matt 24:35), “do not be afraid / let not your hearts be troubled” (John 14:1, 27), “you do not know the hour” (Matt 24:44)."
  ],
  "counter_signals": [
    "Explicit crowd-metric self-critique: “Jesus did not say go into all the world and make big crowds. He said go into all the world and make disciples.”",
    "Multi-ethnic congregational affirmation",
    "No named-party political endorsement",
    "No flag or civil-religion imagery",
    "Repeated call to test the preacher against scripture",
    "$8M/year in missions giving"
  ],
  "findings": [
    {
      "id": "f1-1",
      "axis": 1,
      "severity": "moderate",
      "headline": false,
      "title": "Political voting guidance from the pulpit",
      "timestamp_seconds": 2640,
      "timestamp_display": "00:44:00",
      "pastor_quote": "You be careful how you vote. Some of you are voting for things for movements that when they get in power, they consistently when they get in power criminalize aspects of faithful Christianity.",
      "jesus_quotes": [
        {"citation": "Mark 12:17", "text": "Render to Caesar the things that are Caesar's, and to God the things that are God's."},
        {"citation": "John 6:15", "text": "Perceiving then that they were about to come and take him by force to make him king, Jesus withdrew again to the mountain by himself."},
        {"citation": "John 18:36", "text": "My kingdom is not of this world. If my kingdom were of this world, my servants would have been fighting."}
      ],
      "why_flagged": "When directly presented with opportunities to align his followers with a political program — even a sympathetic one — Jesus deflected, withdrew, or explicitly disclaimed it. Directing congregational voting behavior is a move Jesus specifically refused."
    },
    {
      "id": "f1-2",
      "axis": 1,
      "severity": "low",
      "headline": false,
      "title": "Joke trivializing terrorism",
      "timestamp_seconds": 1530,
      "timestamp_display": "00:25:30",
      "pastor_quote": "Do you guys know how you can tell the difference between a redhead and a terrorist? You can negotiate with a terrorist… It's a joke. That's a joke.",
      "jesus_quotes": [
        {"citation": "Matt 12:36", "text": "I tell you, on the day of judgment people will give account for every careless word they speak."},
        {"citation": "Matt 5:22", "text": "Whoever insults his brother will be liable to the council; and whoever says, ‘You fool!’ will be liable to the hell of fire."},
        {"citation": "Matt 5:44", "text": "Love your enemies and pray for those who persecute you."}
      ],
      "why_flagged": "The joke uses victims of terrorism (and the category “terrorist”) as a punchline. Jesus's red-letter speech ethics are exacting — careless words are judged; contemptuous speech is penalized; enemies (and therefore their victims) are to be loved and prayed for."
    },
    {
      "id": "f1-3",
      "axis": 1,
      "severity": "moderate",
      "headline": false,
      "title": "American birth framed as providential spiritual inheritance",
      "timestamp_seconds": 2550,
      "timestamp_display": "00:42:30",
      "pastor_quote": "You need to bless God and thank him every day that you were born in the United States of America. You need to bless God for that because… you have been the recipient of an undeserved grace from heaven handed down to you. That's a spiritual inheritance hard-earned that people in other countries are not experiencing and have not experienced for centuries.",
      "jesus_quotes": [
        {"citation": "Luke 4:24–27", "text": "Truly, I say to you, no prophet is acceptable in his hometown. But in truth, I tell you, there were many widows in Israel in the days of Elijah… and Elijah was sent to none of them but only to Zarephath, in the land of Sidon, to a woman who was a widow. And there were many lepers in Israel in the time of the prophet Elisha, and none of them was cleansed, but only Naaman the Syrian."},
        {"citation": "Matt 8:10–12", "text": "Truly, I tell you, with no one in Israel have I found such faith. I tell you, many will come from east and west and recline at table with Abraham, Isaac, and Jacob in the kingdom of heaven, while the sons of the kingdom will be thrown into the outer darkness."},
        {"citation": "John 4:21–23", "text": "The hour is coming when neither on this mountain nor in Jerusalem will you worship the Father… the true worshipers will worship the Father in spirit and truth."}
      ],
      "why_flagged": "Jesus systematically decoupled God's favor from national birth — repeatedly commending non-Israelite faith specifically to shame any assumption of national spiritual inheritance. Framing American birth as an ‘undeserved grace from heaven’ and a ‘spiritual inheritance’ is precisely the assumption Jesus's teaching dismantles."
    },
    {
      "id": "f1-4",
      "axis": 1,
      "severity": "severe",
      "headline": true,
      "title": "Islam identified as the religion of the Antichrist",
      "timestamp_seconds": 2850,
      "timestamp_display": "00:47:30",
      "timestamp_end_seconds": 3120,
      "pastor_quote": "The final boss is not going to be in the end, it's not going to be secularism. It will… be another religion that in that religion, they will kill Christians… There is only one world religion whose religion specifically prescribes beheading as the way to quote kill infidels. The Quran specifically calls it striking necks… The Islamic Mahdi is the biblical Antichrist.",
      "jesus_quotes": [
        {"citation": "Luke 9:52–55 (when the disciples proposed identifying a religious outgroup for divine judgment)", "text": "And he sent messengers ahead of him, who went and entered a village of the Samaritans, to make preparations for him. But the people did not receive him… And when his disciples James and John saw it, they said, ‘Lord, do you want us to tell fire to come down from heaven and consume them?’ But he turned and rebuked them."},
        {"citation": "Luke 10:33–37 (the Good Samaritan)", "text": "But a Samaritan, as he journeyed, came to where he was, and when he saw him, he had compassion… ‘Which of these three, do you think, proved to be a neighbor to the man who fell among the robbers?’ He said, ‘The one who showed him mercy.’ And Jesus said to him, ‘You go, and do likewise.’"},
        {"citation": "John 4:7–9 (engaging a religious outsider)", "text": "A woman from Samaria came to draw water. Jesus said to her, ‘Give me a drink.’… (For Jews have no dealings with Samaritans.)"},